{"$schema":"https://json-schema.org/draft/2020-12/schema","$id":"https://github.com/Hawkar-usls/AIFC/schemas/semantic-endpoint-identity-audit-v1.schema.json","title":"AIFC Semantic Endpoint Identity Audit v1","type":"object","additionalProperties":false,"required":["schema","audit_id","entailment_question_id","bridge_theory_id","endpoint_identity_profile_id","capacity_extension_id","current_bridge_axiom_count","current_bridge_aware_atom_count","bridge_endpoint_semantic_identity","bridge_atom_role_identity_binding","bridge_derived_atom_provenance","semantic_authority_status_lineage","entailment_method_conservative_capacity_extension","same_question_method_semantics_preservation","bridge_aware_extended_capacity","solver_invocation_count","result","blocked_subtype","normative_countermodel","audit_content_hash"],"properties":{"schema":{"const":"AIFC/semantic-endpoint-identity-audit/v1"},"audit_id":{"type":"string","minLength":1},"entailment_question_id":{"type":"string","pattern":"^[0-9a-f]{64}$"},"bridge_theory_id":{"type":"string","minLength":1},"endpoint_identity_profile_id":{"type":"string","minLength":1},"capacity_extension_id":{"type":"string","minLength":1},"current_bridge_axiom_count":{"type":"integer","minimum":0},"current_bridge_aware_atom_count":{"type":"integer","minimum":0},"bridge_endpoint_semantic_identity":{"type":"string","minLength":1},"bridge_atom_role_identity_binding":{"type":"string","minLength":1},"bridge_derived_atom_provenance":{"type":"string","minLength":1},"semantic_authority_status_lineage":{"type":"string","minLength":1},"entailment_method_conservative_capacity_extension":{"type":"string","minLength":1},"same_question_method_semantics_preservation":{"type":"string","minLength":1},"bridge_aware_extended_capacity":{"type":"string","minLength":1},"solver_invocation_count":{"type":"integer","minimum":0},"result":{"enum":["BLOCKED","PROVED","REFUTED_BY_COUNTERMODEL"]},"blocked_subtype":{"oneOf":[{"type":"null"},{"type":"string","minLength":1}]},"normative_countermodel":{"oneOf":[{"type":"null"},{"type":"object","additionalProperties":{"type":"boolean"}}]},"audit_content_hash":{"type":"string","pattern":"^[0-9a-f]{64}$"}},"description":"Stored audit result for SAL v1.10 endpoint semantic identity closure."}
