{"schema":"AIFC/semantic-endpoint-identity-audit/v1","audit_id":"AIFC-SAL-V1.10-SEMANTIC-ENDPOINT-IDENTITY-AUDIT-V1","entailment_question_id":"994c979c702b81a0940f28b8039ad36cb48060c426f42eb1f333bf1630e473b6","bridge_theory_id":"AIFC-SAL-V1.10-CROSS-FORMULA-SEMANTIC-BRIDGE-V3","endpoint_identity_profile_id":"AIFC-SAL-V1.10-SEMANTIC-BRIDGE-ENDPOINT-IDENTITY-PROFILE-V1","capacity_extension_id":"AIFC-SAL-V1.10-ENTAILMENT-METHOD-CAPACITY-EXTENSION-V1","current_bridge_axiom_count":0,"current_bridge_aware_atom_count":18,"bridge_endpoint_semantic_identity":"PASS_ENFORCEMENT_IMPLEMENTED_CURRENT_BRIDGE_EMPTY","bridge_atom_role_identity_binding":"PASS_STRICT_ROLE_LOOKUP_IMPLEMENTED_CURRENT_BRIDGE_EMPTY","bridge_derived_atom_provenance":"PASS_REQUIRED_BY_V2_LANGUAGE_CURRENT_BRIDGE_EMPTY","semantic_authority_status_lineage":"NOT_ESTABLISHED_SELF_ASSERTION_BLOCKED","entailment_method_conservative_capacity_extension":"NOT_ESTABLISHED_CANDIDATE_OBJECT_ONLY","same_question_method_semantics_preservation":"NOT_ESTABLISHED","bridge_aware_extended_capacity":"BLOCKED_NO_AUTHORIZED_EXTENSION_18_GT_16","solver_invocation_count":0,"result":"BLOCKED","blocked_subtype":"BLOCKED_UNAUTHORIZED_INTERPRETATION","normative_countermodel":null,"audit_content_hash":"f71a7bbf4b35d0797a136b57a9211af13e1d58ad780f3d238a00a5bcdbd6d438"}
